{
  "instructions": "Independently assess whether each candidate is a disordered flexible interdomain linker; use not_linker, linker, or uncertain. Give evidence and confidence. Source labels and model scores are withheld.",
  "provenance": {
    "nomination_sha256": "695e84dd32f034a9f19adc644d765bdd904cadedb7debaed162eb792404a2a3a",
    "pipeline_commit": "4519cab377c531e0dc3131a8136654b2a98844c3",
    "seed": 41012,
    "source_sha256": "f15ac3eef1edc45b95bc600d661dab348a0cb0bee11e47febeac356ef93db916"
  },
  "records": [
    {
      "candidate_sequence": "RHEEQQRELEEEE",
      "case_id": "TE82-R001",
      "context_end_1based": 343,
      "context_sequence": "QLLQHPFIKNAKPVSILRDLITEAMEIKAKRHEEQQRELEEEEENSDEDELDSHTMVKTSVESVGTMRATSTM",
      "context_start_1based": 271,
      "end_1based": 313,
      "protein_id": "DP01461",
      "reviewer_confidence": null,
      "reviewer_evidence": null,
      "reviewer_label": null,
      "start_1based": 301
    },
    {
      "candidate_sequence": "VDKEHDSAEGSHTSGQSNGR",
      "case_id": "TE82-R002",
      "context_end_1based": 859,
      "context_sequence": "HTYVRCTRSVSIPAPAYYAHLVAFRARYHLVDKEHDSAEGSHTSGQSNGRDHQALAKAVQVHQDTLRTMYFA",
      "context_start_1based": 788,
      "end_1based": 837,
      "protein_id": "DP00736",
      "reviewer_confidence": null,
      "reviewer_evidence": null,
      "reviewer_label": null,
      "start_1based": 818
    },
    {
      "candidate_sequence": "PGEPSGLETLKDTPPPRLIK",
      "case_id": "TE82-R003",
      "context_end_1based": 136,
      "context_sequence": "ILDMIYQGGDLEKCNRAPIYVRVPFLEVNDPGEPSGLETLKDTPPPRLIKSHLPLALLPQTLLDQKVKVVYVARNPKDVA",
      "context_start_1based": 57,
      "end_1based": 106,
      "protein_id": "DP00011",
      "reviewer_confidence": null,
      "reviewer_evidence": null,
      "reviewer_label": null,
      "start_1based": 87
    },
    {
      "candidate_sequence": "NQARAQAALQAVNSVQSGNL",
      "case_id": "TE82-R004",
      "context_end_1based": 192,
      "context_sequence": "YYTSVTPVLRGQPIYIQFSNHKELKTDSSPNQARAQAALQAVNSVQSGNLALAASAAAVDAGMAMAGQSPVLRIIVENLF",
      "context_start_1based": 113,
      "end_1based": 162,
      "protein_id": "DP01601",
      "reviewer_confidence": null,
      "reviewer_evidence": null,
      "reviewer_label": null,
      "start_1based": 143
    },
    {
      "candidate_sequence": "MSFLSRQQPPPPRRAGAACT",
      "case_id": "TE82-R005",
      "context_end_1based": 50,
      "context_sequence": "MSFLSRQQPPPPRRAGAACTLRQKLIFSPCSDCEEEEEEEEEEGSGHSTG",
      "context_start_1based": 1,
      "end_1based": 20,
      "protein_id": "DP00611",
      "reviewer_confidence": null,
      "reviewer_evidence": null,
      "reviewer_label": null,
      "start_1based": 1
    },
    {
      "candidate_sequence": "EPKTDQDEEHCRKVNEYLNN",
      "case_id": "TE82-R006",
      "context_end_1based": 160,
      "context_sequence": "EFKRVPQCPSGRVYVLKFKAGSKRLFFWMQEPKTDQDEEHCRKVNEYLNNPPMPGALGASGSSGHELSALGGEGGLQSLL",
      "context_start_1based": 81,
      "end_1based": 130,
      "protein_id": "DP00839",
      "reviewer_confidence": null,
      "reviewer_evidence": null,
      "reviewer_label": null,
      "start_1based": 111
    },
    {
      "candidate_sequence": "INQGEDSVPAKKFKAAPAEI",
      "case_id": "TE82-R007",
      "context_end_1based": 117,
      "context_sequence": "VCSAVLISESQKLAHYQSRKHANKVRRYMAINQGEDSVPAKKFKAAPAEISDGEDRSKCCPVCNMTFSSPVVAESHYIGK",
      "context_start_1based": 38,
      "end_1based": 87,
      "protein_id": "DP01733",
      "reviewer_confidence": null,
      "reviewer_evidence": null,
      "reviewer_label": null,
      "start_1based": 68
    },
    {
      "candidate_sequence": "LEGFSDPTGQYPRRLGND",
      "case_id": "TE82-R008",
      "context_end_1based": 158,
      "context_sequence": "RVYGHFLDKWKTNGIVLGTYGGIVREKPNRLEGFSDPTGQYPRRLGNDTNVLNQGGEVGYDSSSNVIQDSNLDTAINP",
      "context_start_1based": 81,
      "end_1based": 128,
      "protein_id": "DP00284",
      "reviewer_confidence": null,
      "reviewer_evidence": null,
      "reviewer_label": null,
      "start_1based": 111
    },
    {
      "candidate_sequence": "ALDGVSISDLKSGGVGGSNT",
      "case_id": "TE82-R009",
      "context_end_1based": 470,
      "context_sequence": "LSVLSSSTIIANPDIPEAYKLRGWFDAEGQALDGVSISDLKSGGVGGSNTNWKTLYEVKSENLGQGDKPDYFSSVATVVY",
      "context_start_1based": 391,
      "end_1based": 440,
      "protein_id": "DP00061",
      "reviewer_confidence": null,
      "reviewer_evidence": null,
      "reviewer_label": null,
      "start_1based": 421
    },
    {
      "candidate_sequence": "PEGIIPTLFGPEREKTQAID",
      "case_id": "TE82-R010",
      "context_end_1based": 2024,
      "context_sequence": "QYVFSGDPLRNDEDHAHWTEAKMLLDNIYTPEGIIPTLFGPEREKTQAIDGEFRLRGEQRKTFVELMRRGDLPVWLSYKV",
      "context_start_1based": 1945,
      "end_1based": 1994,
      "protein_id": "DP01931",
      "reviewer_confidence": null,
      "reviewer_evidence": null,
      "reviewer_label": null,
      "start_1based": 1975
    },
    {
      "candidate_sequence": "GSDEWPQRCRGLYVFQGDSS",
      "case_id": "TE82-R011",
      "context_end_1based": 225,
      "context_sequence": "LTCGPASFQCNSSTCIPQLWACDNDPDCEDGSDEWPQRCRGLYVFQGDSSPCSAFEFHCLSGECIHSSWRCDGGPDCKDK",
      "context_start_1based": 146,
      "end_1based": 195,
      "protein_id": "DP01396",
      "reviewer_confidence": null,
      "reviewer_evidence": null,
      "reviewer_label": null,
      "start_1based": 176
    },
    {
      "candidate_sequence": "LICTTTVPWNTSWSNKSLNE",
      "case_id": "TE82-R012",
      "context_end_1based": 638,
      "context_sequence": "GIKQLQARVLAVERYLRDQQLLGIWGCSGKLICTTTVPWNTSWSNKSLNEIWDNMTWMKWEREIDNYTHIIYSLIEQSQN",
      "context_start_1based": 559,
      "end_1based": 608,
      "protein_id": "DP00978",
      "reviewer_confidence": null,
      "reviewer_evidence": null,
      "reviewer_label": null,
      "start_1based": 589
    },
    {
      "candidate_sequence": "VKSAGEVGVKIGNPVPYNEG",
      "case_id": "TE82-R013",
      "context_end_1based": 138,
      "context_sequence": "ASNCVCQVHRFIVNTLKDGRRVVILMDLEVVKSAGEVGVKIGNPVPYNEGHAQQQAVSAPASAATPPASKPQPQNGSLGV",
      "context_start_1based": 59,
      "end_1based": 108,
      "protein_id": "DP01083",
      "reviewer_confidence": null,
      "reviewer_evidence": null,
      "reviewer_label": null,
      "start_1based": 89
    },
    {
      "candidate_sequence": "MASTDYSTYSQAAAQQGYSA",
      "case_id": "TE82-R014",
      "context_end_1based": 50,
      "context_sequence": "MASTDYSTYSQAAAQQGYSAYTAQPTQGYAQTTQAYGQQSYGTYGQPTDV",
      "context_start_1based": 1,
      "end_1based": 20,
      "protein_id": "DP00632",
      "reviewer_confidence": null,
      "reviewer_evidence": null,
      "reviewer_label": null,
      "start_1based": 1
    },
    {
      "candidate_sequence": "RAHALKTKEKLAQTATASSA",
      "case_id": "TE82-R015",
      "context_end_1based": 193,
      "context_sequence": "RDGKDQGVNVREKAKQLVALLRDEDRLREERAHALKTKEKLAQTATASSAAVGSGPPPEAEQAWPQSSGEEELQLQLALA",
      "context_start_1based": 114,
      "end_1based": 163,
      "protein_id": "DP00251",
      "reviewer_confidence": null,
      "reviewer_evidence": null,
      "reviewer_label": null,
      "start_1based": 144
    },
    {
      "candidate_sequence": "MLLILLSVALLALSSA",
      "case_id": "TE82-R016",
      "context_end_1based": 46,
      "context_sequence": "MLLILLSVALLALSSAESSSEDVSQEESLFLISGKPEGRRPQGGNQ",
      "context_start_1based": 1,
      "end_1based": 16,
      "protein_id": "DP00119",
      "reviewer_confidence": null,
      "reviewer_evidence": null,
      "reviewer_label": null,
      "start_1based": 1
    },
    {
      "candidate_sequence": "LKLGDSLKRAVPADWPNNEI",
      "case_id": "TE82-R017",
      "context_end_1based": 210,
      "context_sequence": "VDARGVIRTMLYYPMELGRLVDEILRIVKALKLGDSLKRAVPADWPNNEIIGEGLIVPPPTTEDQARARMESGQYRCLDW",
      "context_start_1based": 131,
      "end_1based": 180,
      "protein_id": "DP00037",
      "reviewer_confidence": null,
      "reviewer_evidence": null,
      "reviewer_label": null,
      "start_1based": 161
    },
    {
      "candidate_sequence": "AAQKRPSQRSKYLASASTMD",
      "case_id": "TE82-R018",
      "context_end_1based": 50,
      "context_sequence": "AAQKRPSQRSKYLASASTMDHARHGFLPRHRDTGILDSLGRFFGSDRGAP",
      "context_start_1based": 1,
      "end_1based": 20,
      "protein_id": "DP00047",
      "reviewer_confidence": null,
      "reviewer_evidence": null,
      "reviewer_label": null,
      "start_1based": 1
    },
    {
      "candidate_sequence": "MKYKPDLIREDEFRDEIRNP",
      "case_id": "TE82-R019",
      "context_end_1based": 523,
      "context_sequence": "LTRSPSVFAKSKENKTKATRFDPSMETLEDMKYKPDLIREDEFRDEIRNPVYQERDTEPRASNASRLLPSKEKPTMHSLR",
      "context_start_1based": 444,
      "end_1based": 493,
      "protein_id": "DP00939",
      "reviewer_confidence": null,
      "reviewer_evidence": null,
      "reviewer_label": null,
      "start_1based": 474
    },
    {
      "candidate_sequence": "PLHVSLANGNRDLDYDSVQP",
      "case_id": "TE82-R020",
      "context_end_1based": 51,
      "context_sequence": "MPLHVSLANGNRDLDYDSVQPYFMCDDEEEDVHHQQPPQPPAPSEDIWKKF",
      "context_start_1based": 1,
      "end_1based": 21,
      "protein_id": "DP00564",
      "reviewer_confidence": null,
      "reviewer_evidence": null,
      "reviewer_label": null,
      "start_1based": 2
    },
    {
      "candidate_sequence": "KAKEEAAKFTKEDLEKNFKT",
      "case_id": "TE82-R021",
      "context_end_1based": 305,
      "context_sequence": "TITKIYNTYTLFSTKLTQMYSTRLDNFAKAKAKEEAAKFTKEDLEKNFKTLLNYIQVSVKTAANFVYINDTHAKRKLENI",
      "context_start_1based": 226,
      "end_1based": 275,
      "protein_id": "DP01047",
      "reviewer_confidence": null,
      "reviewer_evidence": null,
      "reviewer_label": null,
      "start_1based": 256
    },
    {
      "candidate_sequence": "PVPREVLGSATRDQDQLQAW",
      "case_id": "TE82-R022",
      "context_end_1based": 120,